Class 09/.quarto/_freeze/Class 09/execute-results/tex.json

{
  "hash": "51b103ba0999e967560e405304035af1",
  "result": {
    "engine": "knitr",
    "markdown": "---\ntitle: \"Class 09: Candy Mini-Project\"\nauthor: \"Derek Zhang - PID A17819201\"\nformat: pdf\neditor: visual\ntoc: true\n---\n\n## Importing Candy Data\n\nBefore we begin, we must first have the data loaded\n\n\n::: {.cell}\n\n```{.r .cell-code}\ncandy_file <- \"candy-data.csv\"\n\ncandy = read.csv(candy_file, row.names=1)\nhead(candy)\n```\n\n::: {.cell-output .cell-output-stdout}\n\n```\n             chocolate fruity caramel peanutyalmondy nougat crispedricewafer\n100 Grand            1      0       1              0      0                1\n3 Musketeers         1      0       0              0      1                0\nOne dime             0      0       0              0      0                0\nOne quarter          0      0       0              0      0                0\nAir Heads            0      1       0              0      0                0\nAlmond Joy           1      0       0              1      0                0\n             hard bar pluribus sugarpercent pricepercent winpercent\n100 Grand       0   1        0        0.732        0.860   66.97173\n3 Musketeers    0   1        0        0.604        0.511   67.60294\nOne dime        0   0        0        0.011        0.116   32.26109\nOne quarter     0   0        0        0.011        0.511   46.11650\nAir Heads       0   0        0        0.906        0.511   52.34146\nAlmond Joy      0   1        0        0.465        0.767   50.34755\n```\n\n\n:::\n:::\n\n\n## What is in this dataset?\n\n> Q1. There are 85 kinds of candy in this dataset\n\n\n::: {.cell}\n\n```{.r .cell-code}\ndim(candy) # checks dimensions of this dataset to check for rowcount\n```\n\n::: {.cell-output .cell-output-stdout}\n\n```\n[1] 85 12\n```\n\n\n:::\n:::\n\n\n> Q2. There are 38 fruity candy types in this dataset\n\n\n::: {.cell}\n\n```{.r .cell-code}\nsum(candy$fruity) # sums the values of the fruity column\n```\n\n::: {.cell-output .cell-output-stdout}\n\n```\n[1] 38\n```\n\n\n:::\n:::\n\n\n## What is your favorite candy?\n\n\n::: {.cell}\n\n```{.r .cell-code}\nlibrary(dplyr) # installs dplyr\n```\n\n::: {.cell-output .cell-output-stderr}\n\n```\n\nAttaching package: 'dplyr'\n```\n\n\n:::\n\n::: {.cell-output .cell-output-stderr}\n\n```\nThe following objects are masked from 'package:stats':\n\n    filter, lag\n```\n\n\n:::\n\n::: {.cell-output .cell-output-stderr}\n\n```\nThe following objects are masked from 'package:base':\n\n    intersect, setdiff, setequal, union\n```\n\n\n:::\n\n```{.r .cell-code}\ncandy %>%\n  filter(row.names(candy)==\"Twix\") %>% # filter function filters for specific outcome \n  select(winpercent) # keeps the target value and reports it\n```\n\n::: {.cell-output .cell-output-stdout}\n\n```\n     winpercent\nTwix   81.64291\n```\n\n\n:::\n:::\n\n\n> Q3. My favorite candy in this dataset is \"Air Heads\", its winpercent value is 52.3%\n>\n\n> ::: {.cell}\n> \n> ```{.r .cell-code}\n> candy %>%\n>   filter(row.names(candy)==\"Air Heads\") %>% # filter function filters for specific outcome \n>   select(winpercent) # keeps the target value and reports it\n> ```\n> \n> ::: {.cell-output .cell-output-stdout}\n> \n> ```\n>           winpercent\n> Air Heads   52.34146\n> ```\n> \n> \n> :::\n> :::\n\n>\n> Q4. The winpercent value of \"Kit Kat\" is 76.8%\n>\n\n> ::: {.cell}\n> \n> ```{.r .cell-code}\n> candy %>%\n>   filter(row.names(candy)==\"Kit Kat\") %>% # filter function filters for specific outcome \n>   select(winpercent) # keeps the target value and reports it\n> ```\n> \n> ::: {.cell-output .cell-output-stdout}\n> \n> ```\n>         winpercent\n> Kit Kat    76.7686\n> ```\n> \n> \n> :::\n> :::\n\n>\n> Q5. The winpercent value of \"Tootsie Roll Snack Bars\" is 49.7%\n>\n\n> ::: {.cell}\n> \n> ```{.r .cell-code}\n> candy %>%\n>   filter(row.names(candy)==\"Tootsie Roll Snack Bars\") %>% # filter function filters for specific outcome \n>   select(winpercent) # keeps the target value and reports it\n> ```\n> \n> ::: {.cell-output .cell-output-stdout}\n> \n> ```\n>                         winpercent\n> Tootsie Roll Snack Bars    49.6535\n> ```\n> \n> \n> :::\n> :::\n\n\n## `skimr::skim()` function\n\n\n::: {.cell}\n\n```{.r .cell-code}\nlibrary(\"skimr\")\nskim(candy)\n```\n\n::: {.cell-output-display}\n\nTable: Data summary\n\n|                         |      |\n|:------------------------|:-----|\n|Name                     |candy |\n|Number of rows           |85    |\n|Number of columns        |12    |\n|_______________________  |      |\n|Column type frequency:   |      |\n|numeric                  |12    |\n|________________________ |      |\n|Group variables          |None  |\n\n\n**Variable type: numeric**\n\n|skim_variable    | n_missing| complete_rate|  mean|    sd|    p0|   p25|   p50|   p75|  p100|hist  |\n|:----------------|---------:|-------------:|-----:|-----:|-----:|-----:|-----:|-----:|-----:|:-----|\n|chocolate        |         0|             1|  0.44|  0.50|  0.00|  0.00|  0.00|  1.00|  1.00|▇▁▁▁▆ |\n|fruity           |         0|             1|  0.45|  0.50|  0.00|  0.00|  0.00|  1.00|  1.00|▇▁▁▁▆ |\n|caramel          |         0|             1|  0.16|  0.37|  0.00|  0.00|  0.00|  0.00|  1.00|▇▁▁▁▂ |\n|peanutyalmondy   |         0|             1|  0.16|  0.37|  0.00|  0.00|  0.00|  0.00|  1.00|▇▁▁▁▂ |\n|nougat           |         0|             1|  0.08|  0.28|  0.00|  0.00|  0.00|  0.00|  1.00|▇▁▁▁▁ |\n|crispedricewafer |         0|             1|  0.08|  0.28|  0.00|  0.00|  0.00|  0.00|  1.00|▇▁▁▁▁ |\n|hard             |         0|             1|  0.18|  0.38|  0.00|  0.00|  0.00|  0.00|  1.00|▇▁▁▁▂ |\n|bar              |         0|             1|  0.25|  0.43|  0.00|  0.00|  0.00|  0.00|  1.00|▇▁▁▁▂ |\n|pluribus         |         0|             1|  0.52|  0.50|  0.00|  0.00|  1.00|  1.00|  1.00|▇▁▁▁▇ |\n|sugarpercent     |         0|             1|  0.48|  0.28|  0.01|  0.22|  0.47|  0.73|  0.99|▇▇▇▇▆ |\n|pricepercent     |         0|             1|  0.47|  0.29|  0.01|  0.26|  0.47|  0.65|  0.98|▇▇▇▇▆ |\n|winpercent       |         0|             1| 50.32| 14.71| 22.45| 39.14| 47.83| 59.86| 84.18|▃▇▆▅▂ |\n\n\n:::\n:::\n\n\n> Q6. Winpercent is on a distinctly different scale from the other values, which all have means under 1, but winpercent values have a mean of 50.32. But up until pluribus, most of the categories (chocolate, fruity, caramel, peanutyalmondy, nougat, crispedricewafer, hard, bar, pluribus) are all binary values while the others are non-binary. There are two types of scale in question here.\n>\n> Q7. A 0 represents that the candy is not chocolate, under the candy\\$chocolate column, and a 1 under that column means that the candy in question is a chocolate.\n\n## Exploratory analysis\n\n> Q8.\n>\n> ggplot2 method:\n>\n\n> ::: {.cell}\n> \n> ```{.r .cell-code}\n> library(\"ggplot2\")\n> ggplot(candy, aes(x = winpercent)) + # loads a ggplot\n>   geom_histogram() #builds a histogram\n> ```\n> \n> ::: {.cell-output .cell-output-stderr}\n> \n> ```\n> `stat_bin()` using `bins = 30`. Pick better value `binwidth`.\n> ```\n> \n> \n> :::\n> \n> ::: {.cell-output-display}\n> ![](Class-09_files/figure-pdf/unnamed-chunk-9-1.pdf){fig-pos='H'}\n> :::\n> :::\n\n>\n> base R version\n>\n\n> ::: {.cell}\n> \n> ```{.r .cell-code}\n> hist(candy$winpercent) #builds a histogram of the data loaded\n> ```\n> \n> ::: {.cell-output-display}\n> ![](Class-09_files/figure-pdf/unnamed-chunk-10-1.pdf){fig-pos='H'}\n> :::\n> :::\n\n>\n> Q9. The distribution of winpercent is not clearly symmetrical, and seems to be skewed with a tail towards the right side.\n>\n> Q10. The center of the distribution seems to be just above 50%, if considering mean, but if considering median then the center seems to be below 50%. Median is our primary consideration here, however. So the center is below 50%.\n>\n\n> ::: {.cell}\n> \n> ```{.r .cell-code}\n> median(candy$winpercent) # returns median\n> ```\n> \n> ::: {.cell-output .cell-output-stdout}\n> \n> ```\n> [1] 47.82975\n> ```\n> \n> \n> :::\n> \n> ```{.r .cell-code}\n> mean(candy$winpercent) # returns mean\n> ```\n> \n> ::: {.cell-output .cell-output-stdout}\n> \n> ```\n> [1] 50.31676\n> ```\n> \n> \n> :::\n> :::\n\n>\n> Q11. The winpercent of chocolate candies is greater than the winpercent of fruity candies.\n>\n\n> ::: {.cell}\n> \n> ```{.r .cell-code}\n> choc_wp <- candy %>% filter(chocolate == 1) %>% pull(winpercent)\n> #pull method extracts a column as a vector so you don't force a dataframe into mean()\n> fruity_wp <- candy %>% filter(fruity == 1) %>% pull(winpercent)\n> mean(choc_wp)\n> ```\n> \n> ::: {.cell-output .cell-output-stdout}\n> \n> ```\n> [1] 60.92153\n> ```\n> \n> \n> :::\n> \n> ```{.r .cell-code}\n> mean(fruity_wp)\n> ```\n> \n> ::: {.cell-output .cell-output-stdout}\n> \n> ```\n> [1] 44.11974\n> ```\n> \n> \n> :::\n> :::\n\n>\n> Q12. With a p-value of 2.871e-08, the null hypothesis is rejected and there is a statistically significant difference between chocolate candy and fruity candy winpercentages\n>\n\n> ::: {.cell}\n> \n> ```{.r .cell-code}\n> t_test_result <- t.test(choc_wp, fruity_wp) #runs a t-test using two vectors to test for statistical significance difference between two groups of data\n> t_test_result\n> ```\n> \n> ::: {.cell-output .cell-output-stdout}\n> \n> ```\n> \n> \tWelch Two Sample t-test\n> \n> data:  choc_wp and fruity_wp\n> t = 6.2582, df = 68.882, p-value = 2.871e-08\n> alternative hypothesis: true difference in means is not equal to 0\n> 95 percent confidence interval:\n>  11.44563 22.15795\n> sample estimates:\n> mean of x mean of y \n>  60.92153  44.11974 \n> ```\n> \n> \n> :::\n> :::\n\n\n## Overall candy rankings\n\n> Q13. The all time top 5 least favorite candies are Nik L Nip, Boston Baked Beans, Chiclets, Super Bubble, and Jawbusters with the 5 lowest winpercents\n>\n\n> ::: {.cell}\n> \n> ```{.r .cell-code}\n> head(candy[order(candy$winpercent),], n=5) #head only takes the top values, which\n> ```\n> \n> ::: {.cell-output .cell-output-stdout}\n> \n> ```\n>                    chocolate fruity caramel peanutyalmondy nougat\n> Nik L Nip                  0      1       0              0      0\n> Boston Baked Beans         0      0       0              1      0\n> Chiclets                   0      1       0              0      0\n> Super Bubble               0      1       0              0      0\n> Jawbusters                 0      1       0              0      0\n>                    crispedricewafer hard bar pluribus sugarpercent pricepercent\n> Nik L Nip                         0    0   0        1        0.197        0.976\n> Boston Baked Beans                0    0   0        1        0.313        0.511\n> Chiclets                          0    0   0        1        0.046        0.325\n> Super Bubble                      0    0   0        0        0.162        0.116\n> Jawbusters                        0    1   0        1        0.093        0.511\n>                    winpercent\n> Nik L Nip            22.44534\n> Boston Baked Beans   23.41782\n> Chiclets             24.52499\n> Super Bubble         27.30386\n> Jawbusters           28.12744\n> ```\n> \n> \n> :::\n> \n> ```{.r .cell-code}\n> # are the lowest considering it is in ascending order\n> ```\n> :::\n\n>\n> Q14. The top 5 favorite candies by winpercent are Reese's Peanut Butter Cup, Reese's Miniatures, Twix, Kit Kats, and Snickers.\n>\n\n> ::: {.cell}\n> \n> ```{.r .cell-code}\n> tail(candy[order(candy$winpercent),], n=5) # tails returns the tail instead of\n> ```\n> \n> ::: {.cell-output .cell-output-stdout}\n> \n> ```\n>                           chocolate fruity caramel peanutyalmondy nougat\n> Snickers                          1      0       1              1      1\n> Kit Kat                           1      0       0              0      0\n> Twix                              1      0       1              0      0\n> Reese's Miniatures                1      0       0              1      0\n> Reese's Peanut Butter cup         1      0       0              1      0\n>                           crispedricewafer hard bar pluribus sugarpercent\n> Snickers                                 0    0   1        0        0.546\n> Kit Kat                                  1    0   1        0        0.313\n> Twix                                     1    0   1        0        0.546\n> Reese's Miniatures                       0    0   0        0        0.034\n> Reese's Peanut Butter cup                0    0   0        0        0.720\n>                           pricepercent winpercent\n> Snickers                         0.651   76.67378\n> Kit Kat                          0.511   76.76860\n> Twix                             0.906   81.64291\n> Reese's Miniatures               0.279   81.86626\n> Reese's Peanut Butter cup        0.651   84.18029\n> ```\n> \n> \n> :::\n> \n> ```{.r .cell-code}\n> # the head, so it gives the biggest winpercent values\n> ```\n> :::\n\n>\n> Q15.\n>\n\n> ::: {.cell}\n> \n> ```{.r .cell-code}\n> ggplot(candy, aes(x = winpercent, y = rownames(candy))) +\n>   geom_col()\n> ```\n> \n> ::: {.cell-output-display}\n> ![](Class-09_files/figure-pdf/unnamed-chunk-16-1.pdf){fig-pos='H'}\n> :::\n> :::\n\n>\n> Q16.\n>\n\n> ::: {.cell}\n> \n> ```{.r .cell-code}\n> ggplot(candy, aes(x = winpercent, y = reorder(rownames(candy), winpercent))) +\n>   geom_col() \n> ```\n> \n> ::: {.cell-output-display}\n> ![](Class-09_files/figure-pdf/unnamed-chunk-17-1.pdf){fig-pos='H'}\n> :::\n> \n> ```{.r .cell-code}\n> # reorder placed here orders the bars by winpercent descending\n> ```\n> :::\n\n\n## Adding some useful color\n\n\n::: {.cell}\n\n```{.r .cell-code}\nlibrary(ggrepel)\nmy_cols=rep(\"black\", nrow(candy))\nmy_cols[as.logical(candy$chocolate)] = \"chocolate\"\nmy_cols[as.logical(candy$bar)] = \"pink\"\nmy_cols[as.logical(candy$fruity)] = \"red\"\n# as.logical() provides a vector of row indices that are true or 1\n\nggplot(candy) + \n  aes(winpercent, reorder(rownames(candy),winpercent)) +\n  geom_col(fill=my_cols) +\n  ylab(\"\")# labels the y axis\n```\n\n::: {.cell-output-display}\n![](Class-09_files/figure-pdf/unnamed-chunk-18-1.pdf){fig-pos='H'}\n:::\n:::\n\n\n> Q17. The worst ranked chocolate candy is Sixlets\n>\n> Q18. The best ranked fruity candy is Starburst\n\n## Taking a look at pricepercent\n\n\n::: {.cell}\n\n```{.r .cell-code}\nlibrary(ggrepel)\n\n# How about a plot of win vs price\nggplot(candy) +\n  aes(x=winpercent, y=pricepercent, label=rownames(candy)) +\n  geom_point(col=my_cols) + \n  geom_text_repel(col=my_cols, size=3.3, max.overlaps = 5) # repel allows names to not\n```\n\n::: {.cell-output-display}\n![](Class-09_files/figure-pdf/unnamed-chunk-19-1.pdf){fig-pos='H'}\n:::\n\n```{.r .cell-code}\n#overlap and occupy independent space for ease of viewing\n```\n:::\n\n\n> Q19. Based on a ratio of winpercent/pricepercent, you get the top 5 highest winpercent per pricepercent candies: Tootsie Roll Midgies, Pixie Sticks, Fruit Chews, Dum Dums, and Strawberry bon bons\n>\n\n> ::: {.cell}\n> \n> ```{.r .cell-code}\n> candy_ratio <- candy %>% mutate(WP_PP = winpercent/pricepercent) #mutate creates\n> # a new column that is a function of another column\n> ord <- order(candy_ratio$WP_PP, decreasing = FALSE)\n> tail(candy_ratio[ord,], n=5 )\n> ```\n> \n> ::: {.cell-output .cell-output-stdout}\n> \n> ```\n>                      chocolate fruity caramel peanutyalmondy nougat\n> Strawberry bon bons          0      1       0              0      0\n> Dum Dums                     0      1       0              0      0\n> Fruit Chews                  0      1       0              0      0\n> Pixie Sticks                 0      0       0              0      0\n> Tootsie Roll Midgies         1      0       0              0      0\n>                      crispedricewafer hard bar pluribus sugarpercent\n> Strawberry bon bons                 0    1   0        1        0.569\n> Dum Dums                            0    1   0        0        0.732\n> Fruit Chews                         0    0   0        1        0.127\n> Pixie Sticks                        0    0   0        1        0.093\n> Tootsie Roll Midgies                0    0   0        1        0.174\n>                      pricepercent winpercent     WP_PP\n> Strawberry bon bons         0.058   34.57899  596.1895\n> Dum Dums                    0.034   39.46056 1160.6045\n> Fruit Chews                 0.034   43.08892 1267.3212\n> Pixie Sticks                0.023   37.72234 1640.1016\n> Tootsie Roll Midgies        0.011   45.73675 4157.8862\n> ```\n> \n> \n> :::\n> :::\n\n>\n> Q20. The 5 most expensive candies are Nik L Nips, Nestle Smarties, Ring pops, Hershey's Krackels, Hershey's Milk Chocolate, with Nik L Nips at the lowest winpercent so the least favorite at 22.4%, so Nik L Nips are the least popular\n>\n\n> ::: {.cell}\n> \n> ```{.r .cell-code}\n> ord <- order(candy$pricepercent, decreasing = TRUE)\n> head( candy[ord,c(11,12)], n=5 )\n> ```\n> \n> ::: {.cell-output .cell-output-stdout}\n> \n> ```\n>                          pricepercent winpercent\n> Nik L Nip                       0.976   22.44534\n> Nestle Smarties                 0.976   37.88719\n> Ring pop                        0.965   35.29076\n> Hershey's Krackel               0.918   62.28448\n> Hershey's Milk Chocolate        0.918   56.49050\n> ```\n> \n> \n> :::\n> :::\n\n\n## Exploring the correlation structure\n\n\n::: {.cell}\n\n```{.r .cell-code}\nlibrary(corrplot)\n```\n\n::: {.cell-output .cell-output-stderr}\n\n```\ncorrplot 0.95 loaded\n```\n\n\n:::\n\n```{.r .cell-code}\ncij <- cor(candy)\ncorrplot(cij)\n```\n\n::: {.cell-output-display}\n![](Class-09_files/figure-pdf/unnamed-chunk-22-1.pdf){fig-pos='H'}\n:::\n:::\n\n\n> Q22. Fruity and chocolate are the variables that are most strongly negatively correlated. But there are others that are slightly less negatively correlated, such as bar and pluribus.\n>\n> Q23. Fruity and Chocolate will have the largest contribution to the PC1 loadings because they are the variables that are most negatively correlated and will thus pull the data in opposite axis the strongest and drive the most separation.\n\n## Principal component analysis\n\n\n::: {.cell}\n\n```{.r .cell-code}\npca <- prcomp(candy, scale=TRUE) #prcomp generates a PCA analysis of a dataframe\nsummary(pca)\n```\n\n::: {.cell-output .cell-output-stdout}\n\n```\nImportance of components:\n                          PC1    PC2    PC3     PC4    PC5     PC6     PC7\nStandard deviation     2.0788 1.1378 1.1092 1.07533 0.9518 0.81923 0.81530\nProportion of Variance 0.3601 0.1079 0.1025 0.09636 0.0755 0.05593 0.05539\nCumulative Proportion  0.3601 0.4680 0.5705 0.66688 0.7424 0.79830 0.85369\n                           PC8     PC9    PC10    PC11    PC12\nStandard deviation     0.74530 0.67824 0.62349 0.43974 0.39760\nProportion of Variance 0.04629 0.03833 0.03239 0.01611 0.01317\nCumulative Proportion  0.89998 0.93832 0.97071 0.98683 1.00000\n```\n\n\n:::\n:::\n\n\n\n::: {.cell}\n\n```{.r .cell-code}\nplot(pca$x[,1:2]) # plot plots the data\n```\n\n::: {.cell-output-display}\n![](Class-09_files/figure-pdf/unnamed-chunk-24-1.pdf){fig-pos='H'}\n:::\n:::\n\n\n\n::: {.cell}\n\n```{.r .cell-code}\nplot(pca$x[,1:2], col=my_cols, pch=16) \n```\n\n::: {.cell-output-display}\n![](Class-09_files/figure-pdf/unnamed-chunk-25-1.pdf){fig-pos='H'}\n:::\n:::\n\n\n\n::: {.cell}\n\n```{.r .cell-code}\n# Make a new data-frame with our PCA results and candy data\nmy_data <- cbind(candy, pca$x[,1:3]) #cbind correlates dataframes by index\np <- ggplot(my_data) + \n        aes(x=PC1, y=PC2, \n            size=winpercent/100,  \n            text=rownames(my_data),\n            label=rownames(my_data)) +\n        geom_point(col=my_cols)\n\np\n```\n\n::: {.cell-output-display}\n![](Class-09_files/figure-pdf/unnamed-chunk-26-1.pdf){fig-pos='H'}\n:::\n\n```{.r .cell-code}\np + geom_text_repel(size=3.3, col=my_cols, max.overlaps = 7)  + \n  theme(legend.position = \"none\") + #sets a theme for the plot\n  labs(title=\"Halloween Candy PCA Space\", #sets the title of the plot\n       subtitle=\"Colored by type: chocolate bar (dark brown), chocolate other (light brown), fruity (red), other (black)\", \n       caption=\"Data from 538\")\n```\n\n::: {.cell-output-display}\n![](Class-09_files/figure-pdf/unnamed-chunk-26-2.pdf){fig-pos='H'}\n:::\n:::\n\n\n\n::: {.cell}\n\n```{.r .cell-code}\n# library(plotly)\n# ggplotly(p)\n```\n:::\n\n\n> Q24. Fruity has the largest positive loading at approx 0.38, while pluribus comes close at approx 0.27 and hard at approx 0.22. This does make sense because these candies typically come in groups and bags of large quantities. which is a significant shared characteristic (pluribus), and many of these tend to be hard candies, such as skittles, jolly ranchers, so they are hard as well as fruity. This thus makes sense for why they load in PC1 together positively. This relationship was highlighted in the correlation plot prior, where pluribus correlated positively only with fruity candies, and fruity candies correlated positively with hard candies. hard and pluribus candies exclusively positively correlated with fruity candies.\n\n\n::: {.cell}\n\n```{.r .cell-code}\nggplot(pca$rotation) +\n  aes(x = PC1, y = reorder(rownames(pca$rotation), PC1)) +\n  geom_col()\n```\n\n::: {.cell-output-display}\n![](Class-09_files/figure-pdf/unnamed-chunk-28-1.pdf){fig-pos='H'}\n:::\n:::\n\n\n## Summary\n\n> Q25. Based on the statistical analysis conducted here, a winning candy typically tends to be a chocolate candy of bar format, containing peanut/almondy flavors. This is supported by the top 5 candies in the winpercent category which were Reese's Peanut Butter Cup (84.2%), Reese's Miniatures (81.9%), Twix (81.6%), Kit Kat (76.8%), and Snickers (76.7%), all of which share these traits.\n>\n> The bar chart visualization clearly shows chocolate candies dominating the top winpercents, and the correlation analysis reveals that chocolate candies correlate negatively with fruity candies, meaning they are basically mutually exclusive. Thus, we were to design a candy, it would have to be either chocolate or candy or neither, and chocolate consistently scores high on winpercent so it would likely be a chocolate. The Bar format and peanut/almondy flavors are correlated strongly with chocolate candies so that would be a good decision to include.\n>\n> The PCA analysis confirms this structure of candy design. The PC1 separates chocolate from fruity and the highest winpercent candies all cluster on the negative/chocolate side of the PC1. Thus you would likely choose to design a candy that contains the highest negative traits of PC1 for a successful candy given that chocolate is a key dominant winning feature.\n",
    "supporting": [
      "Class-09_files/figure-pdf"
    ],
    "filters": [
      "rmarkdown/pagebreak.lua"
    ],
    "includes": {},
    "engineDependencies": {},
    "preserve": null,
    "postProcess": false
  }
}

Class 09/Class 09.md

## Taking a look at pricepercent

> Q20. The 5 most expensive candies are Nik L Nips, Nestle Smarties,
> Ring pops, Hershey’s Krackels, Hershey’s Milk Chocolate, with Nik L
> Nips at the lowest winpercent so the least favorite at 22.4%, so Nik L
> Nips are the least popular

## Summary

> Q25. Based on the statistical analysis conducted here, a winning candy
> typically tends to be a chocolate candy of bar format, containing
> peanut/almondy flavors. This is supported by the top 5 candies in the
> winpercent category which were Reese’s Peanut Butter Cup (84.2%),
> Reese’s Miniatures (81.9%), Twix (81.6%), Kit Kat (76.8%), and
> Snickers (76.7%), all of which share these traits.
>
> The bar chart visualization clearly shows chocolate candies dominating
> the top winpercents, and the correlation analysis reveals that
> chocolate candies correlate negatively with fruity candies, meaning
> they are basically mutually exclusive. Thus, we were to design a
> candy, it would have to be either chocolate or candy or neither, and
> chocolate consistently scores high on winpercent so it would likely be
> a chocolate. The Bar format and peanut/almondy flavors are correlated
> strongly with chocolate candies so that would be a good decision to
> include.
>
> The PCA analysis confirms this structure of candy design. The PC1
> separates chocolate from fruity and the highest winpercent candies all
> cluster on the negative/chocolate side of the PC1. Thus you would
> likely choose to design a candy that contains the highest negative
> traits of PC1 for a successful candy given that chocolate is a key
> dominant winning feature.